{
  "$schema": "https://json-schema.org/draft/2020-12/schema",
  "title": "PlanV2",
  "type": "object",
  "required": [
    "version",
    "project_id",
    "intent_hash",
    "tasks",
    "prompts",
    "council_checks",
    "cost_estimate",
    "generated_at"
  ],
  "properties": {
    "version": {
      "type": "string",
      "const": "2.0.0",
      "description": "PlanV2 schema version"
    },
    "project_id": {
      "type": "string",
      "pattern": "^[a-z0-9-]+$"
    },
    "intent_hash": {
      "type": "string",
      "pattern": "^sha256:[a-f0-9]{64}$",
      "description": "SHA-256 hash of intent.json that produced this plan"
    },
    "tasks": {
      "type": "array",
      "minItems": 1,
      "items": {
        "$ref": "#/$defs/Task"
      }
    },
    "prompts": {
      "type": "array",
      "items": {
        "$ref": "#/$defs/Prompt"
      },
      "description": "One prompt per feature, used by wave-build agents"
    },
    "council_checks": {
      "$ref": "#/$defs/CouncilChecks"
    },
    "cost_estimate": {
      "$ref": "#/$defs/CostEstimate"
    },
    "generated_at": {
      "type": "string",
      "format": "date-time"
    }
  },
  "$defs": {
    "Task": {
      "type": "object",
      "required": [
        "task_id",
        "feature_id",
        "title",
        "description",
        "order",
        "files",
        "parallel_group",
        "worktree_required",
        "hooks_config",
        "lsp_checks",
        "security_review_required",
        "estimated_cost_usd",
        "real_cost_usd"
      ],
      "properties": {
        "task_id": {
          "type": "string",
          "pattern": "^T[0-9]{3,4}$",
          "description": "Unique task identifier (e.g., T001)"
        },
        "feature_id": {
          "type": "string",
          "pattern": "^F[0-9]{2,3}$",
          "description": "Parent feature ID"
        },
        "title": {
          "type": "string",
          "maxLength": 120
        },
        "description": {
          "type": "string",
          "description": "Detailed description of what the task produces"
        },
        "order": {
          "type": "integer",
          "minimum": 0,
          "description": "Execution order within the feature (0-indexed)"
        },
        "files": {
          "type": "array",
          "items": {
            "$ref": "#/$defs/FileSpec"
          },
          "description": "Files this task creates or modifies"
        },
        "depends_on": {
          "type": "array",
          "items": {
            "type": "string",
            "pattern": "^T[0-9]{3,4}$"
          },
          "description": "Task IDs that must complete before this one"
        },
        "parallel_group": {
          "type": ["integer", "null"],
          "description": "Index into intent.parallel_groups array, or null if sequential"
        },
        "worktree_required": {
          "type": "boolean",
          "description": "True if this task must run in its own git worktree"
        },
        "hooks_config": {
          "type": "array",
          "items": {
            "type": "string",
            "enum": ["pre-write-guard", "post-write-check", "pre-commit-audit"]
          },
          "description": "Which hooks apply to file writes in this task"
        },
        "lsp_checks": {
          "type": "array",
          "items": {
            "type": "string",
            "enum": [
              "type-errors",
              "missing-imports",
              "missing-refs",
              "unused-exports",
              "circular-deps"
            ]
          },
          "description": "LSP-based checks to run after task completion"
        },
        "security_review_required": {
          "type": "boolean",
          "description": "True for auth, billing, api_endpoint category tasks"
        },
        "estimated_cost_usd": {
          "type": "number",
          "minimum": 0,
          "description": "Estimated cost for this task in USD"
        },
        "real_cost_usd": {
          "type": ["number", "null"],
          "description": "Actual cost after execution (null before execution)"
        }
      }
    },
    "FileSpec": {
      "type": "object",
      "required": ["path", "action"],
      "properties": {
        "path": {
          "type": "string",
          "description": "Relative file path from project root"
        },
        "action": {
          "type": "string",
          "enum": ["create", "modify", "delete"],
          "description": "What this task does to the file"
        },
        "description": {
          "type": "string",
          "description": "What changes are made to this file"
        }
      }
    },
    "Prompt": {
      "type": "object",
      "required": ["feature_id", "system_prompt", "user_prompt"],
      "properties": {
        "feature_id": {
          "type": "string",
          "pattern": "^F[0-9]{2,3}$"
        },
        "system_prompt": {
          "type": "string",
          "description": "System prompt for the wave-build agent handling this feature"
        },
        "user_prompt": {
          "type": "string",
          "description": "User prompt with specific implementation instructions"
        },
        "context_files": {
          "type": "array",
          "items": { "type": "string" },
          "description": "File paths the agent should read before building"
        },
        "reference_docs": {
          "type": "array",
          "items": { "type": "string" },
          "description": "URLs from research_urls the agent may fetch"
        }
      }
    },
    "CouncilChecks": {
      "type": "object",
      "required": [
        "task_count_valid",
        "dependency_graph_acyclic",
        "file_conflicts_none",
        "security_tasks_flagged",
        "worktree_conflict_check",
        "hook_compatibility_check",
        "all_passed"
      ],
      "properties": {
        "task_count_valid": {
          "type": "boolean",
          "description": "True if task_count >= feature_count + 1 (scaffold task)"
        },
        "dependency_graph_acyclic": {
          "type": "boolean",
          "description": "True if no circular dependencies exist in task graph"
        },
        "file_conflicts_none": {
          "type": "boolean",
          "description": "True if no two tasks in the same parallel group write to the same file"
        },
        "security_tasks_flagged": {
          "type": "boolean",
          "description": "True if all auth/billing/api_endpoint tasks have security_review_required=true"
        },
        "worktree_conflict_check": {
          "type": "boolean",
          "description": "True if worktree assignments are consistent (no conflicts in branch naming, no shared files across worktrees in same group)"
        },
        "hook_compatibility_check": {
          "type": "boolean",
          "description": "True if all hooks referenced in hooks_config exist and are compatible with the task's file types"
        },
        "all_passed": {
          "type": "boolean",
          "description": "True if all individual checks passed"
        },
        "details": {
          "type": "array",
          "items": {
            "type": "object",
            "properties": {
              "check": { "type": "string" },
              "passed": { "type": "boolean" },
              "message": { "type": "string" }
            }
          },
          "description": "Detailed results for each check"
        }
      }
    },
    "CostEstimate": {
      "type": "object",
      "required": ["total_usd", "per_feature", "profile"],
      "properties": {
        "total_usd": {
          "type": "number",
          "minimum": 0,
          "description": "Total estimated cost across all tasks"
        },
        "per_feature": {
          "type": "object",
          "additionalProperties": {
            "type": "number"
          },
          "description": "Estimated cost per feature ID"
        },
        "profile": {
          "type": "string",
          "enum": ["premium", "balanced", "budget"],
          "description": "Cost profile used for estimation"
        },
        "model_mix": {
          "type": "object",
          "additionalProperties": {
            "type": "string"
          },
          "description": "Model assigned to each feature ID"
        }
      }
    }
  }
}
